{
  "contract": "ai-core-ui-pattern-registry/v1",
  "version": "1.2.0",
  "feature_registry": "registry/ui-ux-features.json",
  "component_registry": "design-system/components.registry.json",
  "patterns": [
    {
      "feature_id": "action.overflow",
      "layer": "pattern",
      "implementation_status": "RUNTIME_V2",
      "component_feature_refs": [
        "action.icon",
        "action.secondary"
      ],
      "contract_source": "registry/ui-ux-features.json#action.overflow",
      "css_selector": ".ui-overflow"
    },
    {
      "feature_id": "form.date-range",
      "layer": "pattern",
      "implementation_status": "RUNTIME_V2",
      "component_feature_refs": [
        "form.date"
      ],
      "contract_source": "registry/ui-ux-features.json#form.date-range",
      "css_selector": ".ui-date-range"
    },
    {
      "feature_id": "form.file-upload",
      "layer": "workflow",
      "implementation_status": "RUNTIME_V2",
      "component_feature_refs": [
        "action.secondary",
        "feedback.progress",
        "feedback.inline-error"
      ],
      "contract_source": "registry/ui-ux-features.json#form.file-upload",
      "css_selector": ".ui-file-upload"
    },
    {
      "feature_id": "form.image-upload",
      "layer": "workflow",
      "implementation_status": "RUNTIME_V2",
      "component_feature_refs": [
        "action.secondary",
        "feedback.progress",
        "feedback.inline-error"
      ],
      "contract_source": "registry/ui-ux-features.json#form.image-upload",
      "css_selector": ".ui-image-upload"
    },
    {
      "feature_id": "form.reorder",
      "layer": "pattern",
      "implementation_status": "RUNTIME_V2",
      "component_feature_refs": [
        "action.icon"
      ],
      "contract_source": "registry/ui-ux-features.json#form.reorder",
      "css_selector": ".ui-reorder"
    },
    {
      "feature_id": "navigation.header",
      "layer": "surface",
      "implementation_status": "RUNTIME_V2",
      "component_feature_refs": [],
      "contract_source": "registry/ui-ux-features.json#navigation.header",
      "css_selector": ".ui-header"
    },
    {
      "feature_id": "navigation.stepper",
      "layer": "workflow",
      "implementation_status": "RUNTIME_V2",
      "component_feature_refs": [
        "action.primary",
        "action.secondary"
      ],
      "contract_source": "registry/ui-ux-features.json#navigation.stepper",
      "css_selector": ".ui-stepper"
    },
    {
      "feature_id": "navigation.restore",
      "layer": "pattern",
      "implementation_status": "CONTRACT_ONLY",
      "component_feature_refs": [
        "action.link"
      ],
      "contract_source": "registry/ui-ux-features.json#navigation.restore"
    },
    {
      "feature_id": "data.list",
      "layer": "surface",
      "implementation_status": "BASE_COMPAT",
      "component_feature_refs": [],
      "contract_source": "registry/ui-ux-features.json#data.list",
      "css_selector": ".ui-list"
    },
    {
      "feature_id": "data.card",
      "layer": "surface",
      "implementation_status": "BASE_COMPAT",
      "component_feature_refs": [],
      "contract_source": "registry/ui-ux-features.json#data.card",
      "css_selector": ".ui-card"
    },
    {
      "feature_id": "data.table",
      "layer": "surface",
      "implementation_status": "RUNTIME_V2",
      "component_feature_refs": [],
      "contract_source": "registry/ui-ux-features.json#data.table",
      "css_selector": ".ui-table"
    },
    {
      "feature_id": "data.sort",
      "layer": "pattern",
      "implementation_status": "RUNTIME_V2",
      "component_feature_refs": [
        "action.secondary",
        "form.select"
      ],
      "contract_source": "registry/ui-ux-features.json#data.sort",
      "css_selector": ".ui-sort"
    },
    {
      "feature_id": "data.filter",
      "layer": "pattern",
      "implementation_status": "RUNTIME_V2",
      "component_feature_refs": [
        "form.search",
        "form.select"
      ],
      "contract_source": "registry/ui-ux-features.json#data.filter",
      "css_selector": ".ui-filter"
    },
    {
      "feature_id": "data.virtual-list",
      "layer": "surface",
      "implementation_status": "CONTRACT_ONLY",
      "component_feature_refs": [],
      "contract_source": "registry/ui-ux-features.json#data.virtual-list"
    },
    {
      "feature_id": "data.detail",
      "layer": "surface",
      "implementation_status": "RUNTIME_V2",
      "component_feature_refs": [],
      "contract_source": "registry/ui-ux-features.json#data.detail",
      "css_selector": ".ui-detail"
    },
    {
      "feature_id": "data.definition",
      "layer": "surface",
      "implementation_status": "RUNTIME_V2",
      "component_feature_refs": [],
      "contract_source": "registry/ui-ux-features.json#data.definition",
      "css_selector": ".ui-definition"
    },
    {
      "feature_id": "data.audit",
      "layer": "surface",
      "implementation_status": "RUNTIME_V2",
      "component_feature_refs": [],
      "contract_source": "registry/ui-ux-features.json#data.audit",
      "css_selector": ".ui-audit"
    },
    {
      "feature_id": "feedback.empty",
      "layer": "pattern",
      "implementation_status": "BASE_COMPAT",
      "component_feature_refs": [],
      "contract_source": "registry/ui-ux-features.json#feedback.empty",
      "css_selector": ".ui-state[data-state=\"empty\"]"
    },
    {
      "feature_id": "feedback.retry",
      "layer": "workflow",
      "implementation_status": "CONTRACT_ONLY",
      "component_feature_refs": [
        "action.secondary",
        "feedback.inline-error"
      ],
      "contract_source": "registry/ui-ux-features.json#feedback.retry"
    },
    {
      "feature_id": "workflow.draft",
      "layer": "workflow",
      "implementation_status": "CONTRACT_ONLY",
      "component_feature_refs": [
        "feedback.alert"
      ],
      "contract_source": "registry/ui-ux-features.json#workflow.draft"
    },
    {
      "feature_id": "workflow.autosave",
      "layer": "workflow",
      "implementation_status": "CONTRACT_ONLY",
      "component_feature_refs": [
        "feedback.progress",
        "feedback.inline-error"
      ],
      "contract_source": "registry/ui-ux-features.json#workflow.autosave"
    },
    {
      "feature_id": "workflow.explicit-save",
      "layer": "workflow",
      "implementation_status": "CONTRACT_ONLY",
      "component_feature_refs": [
        "action.primary",
        "feedback.progress",
        "feedback.alert"
      ],
      "contract_source": "registry/ui-ux-features.json#workflow.explicit-save"
    },
    {
      "feature_id": "workflow.submit",
      "layer": "workflow",
      "implementation_status": "CONTRACT_ONLY",
      "component_feature_refs": [
        "action.primary",
        "feedback.progress",
        "feedback.alert"
      ],
      "contract_source": "registry/ui-ux-features.json#workflow.submit"
    },
    {
      "feature_id": "workflow.delete",
      "layer": "workflow",
      "implementation_status": "CONTRACT_ONLY",
      "component_feature_refs": [
        "action.destructive",
        "overlay.dialog"
      ],
      "contract_source": "registry/ui-ux-features.json#workflow.delete"
    },
    {
      "feature_id": "workflow.undo",
      "layer": "workflow",
      "implementation_status": "CONTRACT_ONLY",
      "component_feature_refs": [
        "action.secondary",
        "feedback.toast"
      ],
      "contract_source": "registry/ui-ux-features.json#workflow.undo"
    },
    {
      "feature_id": "workflow.optimistic",
      "layer": "workflow",
      "implementation_status": "CONTRACT_ONLY",
      "component_feature_refs": [],
      "contract_source": "registry/ui-ux-features.json#workflow.optimistic"
    },
    {
      "feature_id": "workflow.conflict",
      "layer": "workflow",
      "implementation_status": "CONTRACT_ONLY",
      "component_feature_refs": [
        "feedback.alert",
        "overlay.dialog"
      ],
      "contract_source": "registry/ui-ux-features.json#workflow.conflict"
    },
    {
      "feature_id": "workflow.offline",
      "layer": "workflow",
      "implementation_status": "CONTRACT_ONLY",
      "component_feature_refs": [
        "feedback.alert"
      ],
      "contract_source": "registry/ui-ux-features.json#workflow.offline"
    },
    {
      "feature_id": "workflow.permission",
      "layer": "pattern",
      "implementation_status": "CONTRACT_ONLY",
      "component_feature_refs": [],
      "contract_source": "registry/ui-ux-features.json#workflow.permission"
    },
    {
      "feature_id": "workflow.session",
      "layer": "workflow",
      "implementation_status": "CONTRACT_ONLY",
      "component_feature_refs": [
        "feedback.alert",
        "overlay.dialog"
      ],
      "contract_source": "registry/ui-ux-features.json#workflow.session"
    },
    {
      "feature_id": "integration.import",
      "layer": "workflow",
      "implementation_status": "CONTRACT_ONLY",
      "component_feature_refs": [],
      "contract_source": "registry/ui-ux-features.json#integration.import"
    },
    {
      "feature_id": "integration.export",
      "layer": "workflow",
      "implementation_status": "CONTRACT_ONLY",
      "component_feature_refs": [],
      "contract_source": "registry/ui-ux-features.json#integration.export"
    },
    {
      "feature_id": "integration.document-preview",
      "layer": "surface",
      "implementation_status": "RUNTIME_V2",
      "component_feature_refs": [],
      "contract_source": "registry/ui-ux-features.json#integration.document-preview",
      "css_selector": ".ui-document-preview"
    },
    {
      "feature_id": "integration.ai-action",
      "layer": "workflow",
      "implementation_status": "CONTRACT_ONLY",
      "component_feature_refs": [],
      "contract_source": "registry/ui-ux-features.json#integration.ai-action"
    },
    {
      "feature_id": "system.portable-task-panel",